id,name,upper_category_id,year
483,SESSION: Papers: Visualization Authoring & Creation,352,2022
484,SESSION: Papers: Accessibility and Aging - Design & Experiences,352,2022
485,SESSION: Papers: Accessibility - Video Conferencing & Online Communities,352,2022
486,SESSION: Papers: UX of VR,352,2022
487,SESSION: Papers: Cyborg Interactions,352,2022
488,SESSION: Papers: Privacy Decisions,352,2022
489,SESSION: Papers: Reasoning and Sensemaking,352,2022
490,"SESSION: Papers: Connecting through Telephone, Robot or XR",352,2022
491,SESSION: Papers: Immersion,352,2022
492,CHI,,2023
493,SESSION: (Un)Ethical Design,492,2023
494,"SESSION: AI Trust, Transparency and Fairness",492,2023
495,SESSION: AI for Health,492,2023
496,SESSION: AI for Visual Generation,492,2023
497,"SESSION: AI, Cognition & Bias",492,2023
498,SESSION: AR & VR,492,2023
499,SESSION: Accessibility and Care,492,2023
500,SESSION: Accessible Interaction Techniques A,492,2023
501,SESSION: Accessible Interaction Techniques B,492,2023
502,SESSION: Arts/Creativity and Accessibility,492,2023
503,SESSION: Augmentation of human skills,492,2023
504,SESSION: Authentication and Smart Environments,492,2023
505,SESSION: Automation and Gesture based interaction,492,2023
506,SESSION: Body Haptics,492,2023
507,SESSION: Building Bridges,492,2023
508,SESSION: Children & Family,492,2023
509,SESSION: Collaboration in Mixed Realities,492,2023
510,SESSION: Communication and Social Good,492,2023
511,"SESSION: Conversation, Communication & Collaborative AI",492,2023
512,SESSION: Conversational Agents,492,2023
513,SESSION: Creative Applications,492,2023
514,SESSION: Creativity Support,492,2023
515,SESSION: Critical Fairness,492,2023
516,SESSION: Critical Perspectives and Critical Design,492,2023
517,SESSION: Data Analyses and Representation,492,2023
518,SESSION: Data Politics and Poetics,492,2023
519,SESSION: Data for Productivity,492,2023
520,"SESSION: Data practices, permissions, and consent",492,2023
521,SESSION: Data-Driven Storytelling,492,2023
522,SESSION: Design with New Technologies (including AI),492,2023
523,SESSION: Designing and Understanding Embodied Experiences,492,2023
524,SESSION: Digital Safety,492,2023
525,SESSION: Digital Wellbeing,492,2023
526,SESSION: Discovery Track Monday,492,2023
527,SESSION: Discovery Track Thursday,492,2023
528,SESSION: Discovery Track Tuesday,492,2023
529,SESSION: Discovery Track Wednesday,492,2023
530,SESSION: Education and Learning,492,2023
531,SESSION: Education and Support,492,2023
532,SESSION: Embodied and Haptic Systems,492,2023
533,SESSION: Environment HCI,492,2023
534,SESSION: Evolving Forms of Creativity,492,2023
535,"SESSION: Explainable, Responsible, Manageable AI",492,2023
536,SESSION: Eye Gaze and New Body,492,2023
537,"SESSION: Eyes, Wrists, Touch, and Feet",492,2023
538,"SESSION: Fabrication, Input, Sensing",492,2023
539,SESSION: Fostering Meaningful Virtual Connections,492,2023
540,SESSION: From Margin to Centre,492,2023
541,"SESSION: GUIs, Gaze, and Gesture-based Interaction",492,2023
542,SESSION: Games beyond Gaming,492,2023
543,"SESSION: Gender, Trauma, and Wellbeing",492,2023
544,SESSION: HCI for Society and Humanity,492,2023
545,SESSION: Hand Interactions,492,2023
546,SESSION: Haptic and sensing devices,492,2023
547,SESSION: Health Behaviour Change,492,2023
548,SESSION: Health Data and Tracking,492,2023
549,SESSION: Health and Participatory Design,492,2023
550,SESSION: Health and social media,492,2023
551,SESSION: Health over a Distance,492,2023
552,SESSION: Human AI Collaboration A,492,2023
553,SESSION: Human AI Collaboration B,492,2023
554,SESSION: Human-AI collaboration,492,2023
555,SESSION: Human-Robot Interaction,492,2023
556,SESSION: Humans and Machines,492,2023
557,SESSION: Immersive & Ubiquitous Analytics,492,2023
558,SESSION: Immersive Interaction,492,2023
559,SESSION: Inclusive Futures,492,2023
560,SESSION: Interaction and Perception in XR,492,2023
561,SESSION: Interaction modalities,492,2023
562,SESSION: Interaction with AI & Robots,492,2023
563,SESSION: Interactive Learning Support Systems,492,2023
564,SESSION: Interactive Surfaces,492,2023
565,SESSION: Internet of Things for Social Purposes,492,2023
566,SESSION: Large Language Models,492,2023
567,SESSION: Learning and Education,492,2023
568,SESSION: Learning in VR/AR/XR/Immersive Environments,492,2023
569,SESSION: Learning with and about AI,492,2023
570,SESSION: Making Realities,492,2023
571,SESSION: Making Sense & Decisions with Visualization,492,2023
572,SESSION: Managing Health and Care-Giving,492,2023
573,SESSION: Material Interaction,492,2023
574,SESSION: Mental Health,492,2023
575,SESSION: Mental Health and Care Work,492,2023
576,SESSION: Mental Health and Emotion,492,2023
577,SESSION: Metaverse,492,2023
578,SESSION: Metrics and Methods,492,2023
579,SESSION: Mixed reality (AR/VR) and Social VR,492,2023
580,SESSION: Modalities,492,2023
581,SESSION: More Than Human Interactions,492,2023
582,SESSION: More ways to use phones,492,2023
583,SESSION: Nature and Environment,492,2023
584,SESSION: Navigating Spaces and Places,492,2023
585,"SESSION: News, Misinformation, and Social Media",492,2023
586,SESSION: Online Communities,492,2023
587,SESSION: Peer support and caregiving,492,2023
588,SESSION: Platforms and Algorithms,492,2023
589,SESSION: Player Experience,492,2023
590,SESSION: Pointing and Icons,492,2023
591,SESSION: Privacy Perceptions and Misconceptions,492,2023
592,SESSION: Privacy and the Web,492,2023
593,SESSION: Programming,492,2023
594,SESSION: Reflexions,492,2023
595,SESSION: Remote Communication and Collaboration,492,2023
596,SESSION: Remote Work and Collaboration,492,2023
597,SESSION: Security Awareness and Phishing,492,2023
598,SESSION: Sensor Integration,492,2023
599,SESSION: Smart Living + Smart Things,492,2023
600,SESSION: Smart homes and Makers,492,2023
601,SESSION: Smarter assistants and living,492,2023
602,SESSION: Smartphones and Notifications,492,2023
603,SESSION: Social Justice Methodologies,492,2023
604,SESSION: Social Media and Information,492,2023
605,SESSION: Social Media and Moderation,492,2023
606,SESSION: Social Network and Support,492,2023
607,SESSION: Social and Eduation in Games,492,2023
608,SESSION: Soma Design,492,2023
609,SESSION: Spatial and 3D,492,2023
610,SESSION: Speech and Remapping Techniques,492,2023
611,SESSION: Supporting Learning in Classrooms and Online Courses,492,2023
612,SESSION: Supporting users in AR and VR,492,2023
613,SESSION: Technology-Powered Learning,492,2023
614,SESSION: Text Input and Textual Communication,492,2023
615,SESSION: Theory and Model Development,492,2023
616,SESSION: Tools for Creativity,492,2023
617,SESSION: Tools for data scientists and Literature Reviews,492,2023
618,SESSION: Touch & forces?,492,2023
619,SESSION: Transportation and AI/ML,492,2023
620,SESSION: Trust and Explainable AI,492,2023
621,SESSION: UX methods and practices,492,2023
622,SESSION: Understanding Outdoor Activities,492,2023
623,SESSION: User Behavior Simulation and Modeling,492,2023
624,SESSION: VR / AR/ Videoconferencing for Accessibility,492,2023
625,SESSION: VR/AR/XR Play Experiences,492,2023
626,SESSION: Video Sharing,492,2023
627,SESSION: Videos,492,2023
628,SESSION: Vis and People,492,2023
629,SESSION: Visualization Grammars and Design,492,2023
630,SESSION: Visualization Literacy & Trust,492,2023
631,SESSION: Visualization Perception,492,2023
632,SESSION: Visualization and Data,492,2023
633,SESSION: Visualization for AI/ML,492,2023
634,SESSION: Visualization in Practice,492,2023
635,SESSION: Voice Interaction / Smart Assistants,492,2023
636,SESSION: Wearables and Materials,492,2023
637,SESSION: Work and Tools,492,2023
638,SESSION: Working with Data,492,2023
639,SESSION: Workplace and Vulnerable Population,492,2023
640,SESSION: XR Beyond the Living Room,492,2023
